{
  "schemaVersion": 2,
  "workerId": "A1",
  "frozenSourceCommit": "4748fe04f19afdf6b27c4c12502b84db325e7294",
  "frozenSourceTree": "fe1fa8fb5fe4de8e7c1d867a83e08375bc1d0c91",
  "baseCommit": "3a1f2df54e21e0881b5f5f1e8d9b52ef33c279a6",
  "baseTree": "94a637078e1e481329dac3d81da168f5e8111cce",
  "branch": "audit/ucl-a1-remediation-r4-1",
  "implementationSubjectCommit": "7dbf42bd3a72ba8b11c8342ad0abb150e0268c3d",
  "implementationSubjectTree": "bf3c1da94688e50b673d660ff0b79a459ac26755",
  "worktreeCleanAtHandoff": true,
  "completedAtUtc": "2026-08-30T17:04:53Z",
  "report": {
    "path": "docs/audits/2026-08-30/A1-backend-composition-r4-1.md",
    "sha256": "1d57e9d62e4db9567028a66d240f69e9b035930512c3aac187e232a2cd04e161",
    "bytes": 14828
  },
  "transport": "remote",
  "remoteRef": "refs/remotes/origin/audit/ucl-a1-remediation-r4-1",
  "bundle": null,
  "evidenceManifest": null,
  "testTotals": {
    "discovered": 1590,
    "executed": 1590,
    "passed": 1568,
    "failed": 22,
    "skipped": 0
  },
  "nativeDisposition": "blocked"
}
